{
  "name": "wellmaintained",
  "owner": {
    "name": "David Laing",
    "email": "david@davidlaing.com"
  },
  "metadata": {
    "description": "Well-maintained plugins for Claude Code",
    "version": "1.0.1",
    "homepage": "https://github.com/wellmaintained/skills",
    "lastUpdated": "2025-11-07T07:14:34Z",
    "pluginCount": 1
  },
  "plugins": [
    {
      "name": "beads-bridge",
      "source": {
        "source": "url",
        "url": "https://github.com/wellmaintained/skills.git",
        "path": "plugins/beads-bridge"
      },
      "description": "Bridge Beads issue tracking with GitHub Projects and Shortcut for unified project visibility across multiple repositories",
      "version": "2.0.0",
      "author": {
        "name": "David Laing",
        "email": "david@davidlaing.com"
      },
      "license": "MIT",
      "homepage": "https://github.com/wellmaintained/skills/tree/main/plugins/beads-bridge"
    }
  ]
}
